{
  "$schema": "https://flowblind.local/schemas/flowblind-catalog-hidden-flow-package-lock-v1.schema.json",
  "actions": [
    "prepare-study",
    "run-and-verify-study"
  ],
  "artifacts": [
    {
      "bundledPath": "data/schemas/flowblind-catalog-hidden-flow-input-v1.schema.json",
      "byteLength": 705,
      "id": "flowblind-catalog-hidden-flow-input-v1",
      "mediaType": "application/schema+json",
      "role": "capability-schema-v1",
      "sha256": "a40cb565a5cf7c951f8d704824d7760a66bdf51875b40f40fca52198ef68a1a1",
      "sourceReference": "schemas/flowblind-catalog-hidden-flow-input-v1.schema.json"
    },
    {
      "bundledPath": "data/schemas/flowblind-catalog-hidden-flow-action-response-v1.schema.json",
      "byteLength": 13743,
      "id": "flowblind-catalog-hidden-flow-action-response-v1",
      "mediaType": "application/schema+json",
      "role": "capability-schema-v1",
      "sha256": "53ace02be2506bd27ea4fd3839b027ec1b87974407b0779027b5546769615ade",
      "sourceReference": "schemas/flowblind-catalog-hidden-flow-action-response-v1.schema.json"
    },
    {
      "bundledPath": "data/schemas/flowblind-catalog-hidden-flow-preparation-bundle-v1.schema.json",
      "byteLength": 8632,
      "id": "flowblind-catalog-hidden-flow-preparation-bundle-v1",
      "mediaType": "application/schema+json",
      "role": "capability-schema-v1",
      "sha256": "9375b5cac033d8ed1234049807bc4e1303f7493fb2bb803844098e646fd509f4",
      "sourceReference": "schemas/flowblind-catalog-hidden-flow-preparation-bundle-v1.schema.json"
    },
    {
      "bundledPath": "data/schemas/flowblind-catalog-hidden-flow-verified-run-v1.schema.json",
      "byteLength": 8831,
      "id": "flowblind-catalog-hidden-flow-verified-run-v1",
      "mediaType": "application/schema+json",
      "role": "capability-schema-v1",
      "sha256": "d4a76ca4dc48813b97b83fb2fd951f9495d6e9e8119623732332edf540cccd60",
      "sourceReference": "schemas/flowblind-catalog-hidden-flow-verified-run-v1.schema.json"
    },
    {
      "bundledPath": "data/schemas/flowblind-catalog-hidden-flow-evidence-v1.schema.json",
      "byteLength": 22067,
      "id": "flowblind-catalog-hidden-flow-evidence-v1",
      "mediaType": "application/schema+json",
      "role": "capability-schema-v1",
      "sha256": "a3567bf7edbb697fa3e0c5a19895b9cc057d55ec86de45db109eae38f5f44196",
      "sourceReference": "schemas/flowblind-catalog-hidden-flow-evidence-v1.schema.json"
    },
    {
      "bundledPath": "data/schemas/flowblind-catalog-hidden-flow-problem-acceptance-v1.schema.json",
      "byteLength": 12722,
      "id": "flowblind-catalog-hidden-flow-problem-acceptance-v1",
      "mediaType": "application/schema+json",
      "role": "capability-schema-v1",
      "sha256": "72bb78b2b5ad529656dd03f341849a2e165c3a831a315cef22c9a796cfbde9b7",
      "sourceReference": "schemas/flowblind-catalog-hidden-flow-problem-acceptance-v1.schema.json"
    },
    {
      "bundledPath": "data/schemas/flowblind-catalog-hidden-flow-report-verification-v1.schema.json",
      "byteLength": 5754,
      "id": "flowblind-catalog-hidden-flow-report-verification-v1",
      "mediaType": "application/schema+json",
      "role": "capability-schema-v1",
      "sha256": "e32b09f7e38b451eb778c3de28c9b55f56d1674862a9cdc21ac1f8c6ca02ab5e",
      "sourceReference": "schemas/flowblind-catalog-hidden-flow-report-verification-v1.schema.json"
    },
    {
      "bundledPath": "data/schemas/flowblind-catalog-hidden-flow-package-evidence-v1.schema.json",
      "byteLength": 2309,
      "id": "flowblind-catalog-hidden-flow-package-evidence-v1",
      "mediaType": "application/schema+json",
      "role": "capability-schema-v1",
      "sha256": "d32ffe4163af1ff70df6400f7c39f386502ca2218e9d33733c142a86517b4c80",
      "sourceReference": "schemas/flowblind-catalog-hidden-flow-package-evidence-v1.schema.json"
    },
    {
      "bundledPath": "data/schemas/flowblind-catalog-hidden-flow-review-attestation-v1.schema.json",
      "byteLength": 7193,
      "id": "flowblind-catalog-hidden-flow-review-attestation-v1",
      "mediaType": "application/schema+json",
      "role": "capability-schema-v1",
      "sha256": "c4d4a8a31d5855fa7c1c2b15215b9b6d414551e5a943c1402920c838a9e67672",
      "sourceReference": "schemas/flowblind-catalog-hidden-flow-review-attestation-v1.schema.json"
    },
    {
      "bundledPath": "data/schemas/flowblind-catalog-hidden-flow-review-policy-v1.schema.json",
      "byteLength": 3440,
      "id": "flowblind-catalog-hidden-flow-review-policy-v1",
      "mediaType": "application/schema+json",
      "role": "capability-schema-v1",
      "sha256": "e5a552ddb0afc8d35a0660678eb1f21a2870adf62fb9783b448160f7cfd5b230",
      "sourceReference": "schemas/flowblind-catalog-hidden-flow-review-policy-v1.schema.json"
    },
    {
      "bundledPath": "data/schemas/flowblind-catalog-hidden-flow-declaration-v1.schema.json",
      "byteLength": 5284,
      "id": "flowblind-catalog-hidden-flow-declaration-v1",
      "mediaType": "application/schema+json",
      "role": "capability-schema-v1",
      "sha256": "edd2511511ad34e16068464989c5fc12485e2982def8075d58d624714933a145",
      "sourceReference": "schemas/flowblind-catalog-hidden-flow-declaration-v1.schema.json"
    },
    {
      "bundledPath": "data/schemas/flowblind-catalog-hidden-flow-package-lock-v1.schema.json",
      "byteLength": 2840,
      "id": "flowblind-catalog-hidden-flow-package-lock-v1",
      "mediaType": "application/schema+json",
      "role": "capability-schema-v1",
      "sha256": "eb2f10353f8a211ae1014f4af17593e10d0e150e5c338280230e168c0a07bbd5",
      "sourceReference": "schemas/flowblind-catalog-hidden-flow-package-lock-v1.schema.json"
    },
    {
      "bundledPath": "data/schemas/hidden-flow-problem.schema.json",
      "byteLength": 12075,
      "id": "hidden-flow-problem-schema",
      "mediaType": "application/schema+json",
      "role": "generic-problem-contract-schema",
      "sha256": "75486c4816e9c9a8e0af93b988f935b77ecc4e30cb0f61fcbba357111983c0f6",
      "sourceReference": "schemas/hidden-flow-problem.schema.json"
    },
    {
      "bundledPath": "data/reviewed-source/src/domain/hiddenFlowModel.ts",
      "byteLength": 14616,
      "id": "hidden-flow-model-source",
      "mediaType": "text/typescript",
      "role": "reviewed-generic-model-source",
      "sha256": "0c13694eab9f3b36190c411cb4440bfec907502bf606e550153c2679d3ee4176",
      "sourceReference": "src/domain/hiddenFlowModel.ts"
    },
    {
      "bundledPath": "data/reviewed-source/src/domain/hiddenFlowValidation.ts",
      "byteLength": 22645,
      "id": "hidden-flow-problem-parser-source",
      "mediaType": "text/typescript",
      "role": "reviewed-generic-parser-source",
      "sha256": "05df92231f78c9c38295284cf71229cbb77d8af99f8276211843e758274388c9",
      "sourceReference": "src/domain/hiddenFlowValidation.ts"
    },
    {
      "bundledPath": "data/reviewed-source/src/domain/hiddenFlowBasis.ts",
      "byteLength": 18924,
      "id": "hidden-flow-basis-source",
      "mediaType": "text/typescript",
      "role": "reviewed-generic-basis-source",
      "sha256": "b144505e3e23717284b0783ba8cba3464b5db227be46e94f4e1410fce808271c",
      "sourceReference": "src/domain/hiddenFlowBasis.ts"
    },
    {
      "bundledPath": "data/reviewed-source/src/domain/hiddenFlowOperator.ts",
      "byteLength": 8196,
      "id": "hidden-flow-operator-source",
      "mediaType": "text/typescript",
      "role": "reviewed-generic-operator-source",
      "sha256": "c7bf2af49306896f8db086d29883abdffe6021c3a77af3ddadde4d91fcd9f1b0",
      "sourceReference": "src/domain/hiddenFlowOperator.ts"
    },
    {
      "bundledPath": "data/reviewed-source/src/domain/hiddenFlowVerification.ts",
      "byteLength": 32253,
      "id": "hidden-flow-independent-verifier-source",
      "mediaType": "text/typescript",
      "role": "reviewed-independent-verifier-source",
      "sha256": "01c43547c6f2e3345ef99bdab167da192bf8bedd4fbf30f9d4a4c764786acb45",
      "sourceReference": "src/domain/hiddenFlowVerification.ts"
    },
    {
      "bundledPath": "data/reviewed-source/src/application/hiddenFlowEvidenceReport.ts",
      "byteLength": 15601,
      "id": "hidden-flow-neutral-report-source",
      "mediaType": "text/typescript",
      "role": "reviewed-neutral-report-source",
      "sha256": "05003cec629e3e11c00c1e1ec5d94669cb8a29488efef6fe5e499f2aa91ef8eb",
      "sourceReference": "src/application/hiddenFlowEvidenceReport.ts"
    },
    {
      "bundledPath": "data/reviewed-source/src/application/evidenceReport.ts",
      "byteLength": 11999,
      "id": "canonical-evidence-json-source",
      "mediaType": "text/typescript",
      "role": "reviewed-runtime-dependency-source",
      "sha256": "a2407ca877333a6830f442fd12fbd3c0fc86f81300ee8993d88bdf3e91159807",
      "sourceReference": "src/application/evidenceReport.ts"
    },
    {
      "bundledPath": "data/reviewed-source/tools/discovery/flowblindDisplayText.ts",
      "byteLength": 2841,
      "id": "flowblind-display-text-source",
      "mediaType": "text/typescript",
      "role": "reviewed-runtime-dependency-source",
      "sha256": "b32b1074a62593db1713d38b6d3a601fcfc229e506f211e29c317c38b3bbad56",
      "sourceReference": "tools/discovery/flowblindDisplayText.ts"
    },
    {
      "bundledPath": "data/reviewed-source/src/domain/hiddenFlowSolverValidation.ts",
      "byteLength": 15049,
      "id": "hidden-flow-solver-result-parser-source",
      "mediaType": "text/typescript",
      "role": "reviewed-runtime-dependency-source",
      "sha256": "e49b6daa037777cdc6cd8b4b82e1ea9e89c3fef9d197a81224c065699695c29e",
      "sourceReference": "src/domain/hiddenFlowSolverValidation.ts"
    },
    {
      "bundledPath": "data/reviewed-source/src/version.ts",
      "byteLength": 93,
      "id": "flowblind-version-source",
      "mediaType": "text/typescript",
      "role": "reviewed-runtime-dependency-source",